[
  {
    "order_id": "300",
    "customer_id": "CUST-0001",
    "status": "shipped",
    "placed_at": "2026-09-12T09:00:00Z",
    "promised_delivery_date": "2026-09-19",
    "shipping_method": "standard",
    "currency": "EUR",
    "item_count": 3,
    "items_summary": "1x Casque Bluetooth Aria; 2x Câble USB-C 2 m",
    "total_amount": "149.70",
    "delivery_note": ""
  },
  {
    "order_id": "301",
    "customer_id": "CUST-0001",
    "status": "delivered",
    "placed_at": "2026-09-02T09:00:00Z",
    "promised_delivery_date": "2026-09-08",
    "shipping_method": "standard",
    "currency": "EUR",
    "item_count": 1,
    "items_summary": "1x Lampe de bureau LED",
    "total_amount": "45.00",
    "delivery_note": ""
  },
  {
    "order_id": "302",
    "customer_id": "CUST-0001",
    "status": "preparing",
    "placed_at": "2026-09-21T09:00:00Z",
    "promised_delivery_date": "2026-09-27",
    "shipping_method": "standard",
    "currency": "EUR",
    "item_count": 1,
    "items_summary": "1x Sac à dos 20 L",
    "total_amount": "59.00",
    "delivery_note": "Laisser chez le voisin si absent."
  },
  {
    "order_id": "303",
    "customer_id": "CUST-0002",
    "status": "delivered",
    "placed_at": "2026-09-05T09:00:00Z",
    "promised_delivery_date": "2026-09-10",
    "shipping_method": "express",
    "currency": "EUR",
    "item_count": 1,
    "items_summary": "1x Écran 27 pouces",
    "total_amount": "289.00",
    "delivery_note": ""
  },
  {
    "order_id": "304",
    "customer_id": "CUST-0002",
    "status": "shipped",
    "placed_at": "2026-09-14T09:00:00Z",
    "promised_delivery_date": "2026-09-18",
    "shipping_method": "standard",
    "currency": "EUR",
    "item_count": 2,
    "items_summary": "1x Clavier mécanique; 1x Souris sans fil",
    "total_amount": "138.00",
    "delivery_note": "Code portail 4521B"
  },
  {
    "order_id": "305",
    "customer_id": "CUST-0002",
    "status": "cancelled",
    "placed_at": "2026-09-09T09:00:00Z",
    "promised_delivery_date": "2026-09-15",
    "shipping_method": "standard",
    "currency": "EUR",
    "item_count": 1,
    "items_summary": "1x Chaise ergonomique",
    "total_amount": "349.00",
    "delivery_note": ""
  },
  {
    "order_id": "306",
    "customer_id": "CUST-0003",
    "status": "delivered",
    "placed_at": "2026-09-01T09:00:00Z",
    "promised_delivery_date": "2026-09-06",
    "shipping_method": "standard",
    "currency": "EUR",
    "item_count": 1,
    "items_summary": "1x Tablette 10 pouces",
    "total_amount": "219.00",
    "delivery_note": ""
  },
  {
    "order_id": "307",
    "customer_id": "CUST-0003",
    "status": "delivered",
    "placed_at": "2026-09-10T09:00:00Z",
    "promised_delivery_date": "2026-09-15",
    "shipping_method": "standard",
    "currency": "EUR",
    "item_count": 1,
    "items_summary": "1x Enceinte portable",
    "total_amount": "79.90",
    "delivery_note": ""
  },
  {
    "order_id": "308",
    "customer_id": "CUST-0003",
    "status": "paid",
    "placed_at": "2026-09-19T09:00:00Z",
    "promised_delivery_date": "2026-09-26",
    "shipping_method": "standard",
    "currency": "EUR",
    "item_count": 1,
    "items_summary": "1x Imprimante laser",
    "total_amount": "189.00",
    "delivery_note": ""
  },
  {
    "order_id": "309",
    "customer_id": "CUST-0004",
    "status": "returned",
    "placed_at": "2026-09-03T09:00:00Z",
    "promised_delivery_date": "2026-09-09",
    "shipping_method": "standard",
    "currency": "EUR",
    "item_count": 1,
    "items_summary": "1x Disque externe 2 To",
    "total_amount": "89.00",
    "delivery_note": ""
  },
  {
    "order_id": "310",
    "customer_id": "CUST-0004",
    "status": "delivered",
    "placed_at": "2026-08-26T09:00:00Z",
    "promised_delivery_date": "2026-09-01",
    "shipping_method": "standard",
    "currency": "EUR",
    "item_count": 1,
    "items_summary": "1x Montre connectée",
    "total_amount": "199.00",
    "delivery_note": ""
  },
  {
    "order_id": "311",
    "customer_id": "CUST-0004",
    "status": "shipped",
    "placed_at": "2026-09-20T09:00:00Z",
    "promised_delivery_date": "2026-09-23",
    "shipping_method": "express",
    "currency": "EUR",
    "item_count": 1,
    "items_summary": "1x Webcam 4K",
    "total_amount": "119.00",
    "delivery_note": "Livraison avant 12h si possible"
  },
  {
    "order_id": "312",
    "customer_id": "CUST-0005",
    "status": "shipped",
    "placed_at": "2026-09-04T09:00:00Z",
    "promised_delivery_date": "2026-09-10",
    "shipping_method": "standard",
    "currency": "EUR",
    "item_count": 1,
    "items_summary": "1x Station d'accueil USB-C",
    "total_amount": "149.00",
    "delivery_note": ""
  },
  {
    "order_id": "313",
    "customer_id": "CUST-0005",
    "status": "delivered",
    "placed_at": "2026-09-08T09:00:00Z",
    "promised_delivery_date": "2026-09-13",
    "shipping_method": "standard",
    "currency": "EUR",
    "item_count": 3,
    "items_summary": "1x Stylets x2; 1x Coque tablette; 1x Film protecteur",
    "total_amount": "57.70",
    "delivery_note": ""
  },
  {
    "order_id": "314",
    "customer_id": "CUST-0005",
    "status": "created",
    "placed_at": "2026-09-22T09:00:00Z",
    "promised_delivery_date": "2026-09-29",
    "shipping_method": "standard",
    "currency": "EUR",
    "item_count": 1,
    "items_summary": "1x NAS 2 baies",
    "total_amount": "399.00",
    "delivery_note": ""
  },
  {
    "order_id": "315",
    "customer_id": "CUST-0006",
    "status": "delivered",
    "placed_at": "2026-09-06T09:00:00Z",
    "promised_delivery_date": "2026-09-12",
    "shipping_method": "standard",
    "currency": "EUR",
    "item_count": 1,
    "items_summary": "1x Microphone USB",
    "total_amount": "89.00",
    "delivery_note": ""
  },
  {
    "order_id": "316",
    "customer_id": "CUST-0006",
    "status": "shipped",
    "placed_at": "2026-09-18T09:00:00Z",
    "promised_delivery_date": "2026-09-25",
    "shipping_method": "standard",
    "currency": "EUR",
    "item_count": 1,
    "items_summary": "1x Routeur Wi-Fi 6",
    "total_amount": "159.00",
    "delivery_note": ""
  },
  {
    "order_id": "317",
    "customer_id": "CUST-0006",
    "status": "delivered",
    "placed_at": "2026-09-16T09:00:00Z",
    "promised_delivery_date": "2026-09-22",
    "shipping_method": "standard",
    "currency": "EUR",
    "item_count": 2,
    "items_summary": "2x Tapis de souris XL",
    "total_amount": "29.80",
    "delivery_note": ""
  },
  {
    "order_id": "318",
    "customer_id": "CUST-0002",
    "status": "preparing",
    "placed_at": "2026-09-22T09:00:00Z",
    "promised_delivery_date": "2026-09-24",
    "shipping_method": "express",
    "currency": "EUR",
    "item_count": 1,
    "items_summary": "1x SSD NVMe 1 To",
    "total_amount": "109.00",
    "delivery_note": ""
  },
  {
    "order_id": "319",
    "customer_id": "CUST-0001",
    "status": "delivered",
    "placed_at": "2026-08-29T09:00:00Z",
    "promised_delivery_date": "2026-09-04",
    "shipping_method": "standard",
    "currency": "EUR",
    "item_count": 1,
    "items_summary": "1x Hub USB 4 ports",
    "total_amount": "29.90",
    "delivery_note": ""
  }
]
